review_title,review_rating,review_date,review_body,user_contributions
my stay,50,Date of stay: September 2019,"The service was excellent, and the hotel was very clean. We didn't have time to eat at the restaurant, but the food looked amazing! If I am ever back in Napoli, I would prefer to stay at the Romeo hotel.",1
Amazing Hotel,50,Date of stay: June 2019,This hotel was amazing! From its room to its breakfast its pool although small but was very practical with its heated water and jacuzzi and the view was breath taking. The coffee house was excellent with its choice of food and the service was Impeccable. This was the only thing we found enjoyable in Naples and not forgetting the location just a stone throw to the ferry terminal. what more can you ask for . However the Michelin rated restaurant was a disappointment I think the food at the coffee house was much better.,7
Special thanks,50,Date of stay: August 2019,"Our stay was really special and very pleasant . My wife and myself would like to take this opportunity to thank our very special staff, at the beluga restaurant, that took a really great care of us and was very professional “Giovanni” . It is just a great job Giovanni , please keep it on and wish u all the best. Regards",4
"Friendly staff, nice room, poor food",20,Date of stay: August 2019,"Nice greeting on arrival. Room is comfortable. But quite shocked to order a ham and cheese sandwich for €23 - in a 5 star hotel, and this is all it is. (Attached) Bite is mine, one of the most bland sandwiches I’ve ever had. No different from a €2 sandwich from a service station. Earlier today my wife had a salad & felt very ill all day afterwards. My club sandwich was also poor. Cannot recommend highly, sadly.",4
Romeo My Love,50,Date of stay: August 2019,"Top Top Top! Best welcome ever, Top Penthouse Suite ever, Top Breakfast with amazing views and a incredible panoramic Pool. Still dreaming the warm Sfogliatella brough to my table. I loved my stay, loved Naples, cannot wait to be back.",8
Mediocre experience overall,20,Date of stay: August 2019,"Booked one night before heading back home, after 10 wonderful days spent on the Amalfi coast. Reserved a Deluxe Harbour View on the Hotel's website. Lack of attention and generosity during our stay: no availability at the Spa upon arrival (for any treatment actually), no alternative options were given for the next day. Not a 5 star experience. Other small details created some frustration, and made us feel uncared for, neglected. We did have a great dinner at the Bistrot, thank you to the team on the 9th floor. Will not come back nor recommend the Romeo.",20
Romantic stay in Romeo Hotel,50,Date of stay: August 2019,"This was a very lovely stay in a hotel with only friendly people…valet parking perfect, gastronomic dinner in Il Comandante ! We will be back soon, to enjoy again all the experiences we had during our short stay",222
Aug 1-4 Stay,30,Date of stay: August 2019,"Decent hotel, however the bed mattress was very poor. We could feel the springs and the boxspring through the mattress. For the price charged and star rating, would have expected better. Hallways were also very noisy.",2
Upscale style in great location,40,Date of stay: April 2019,"The newest and probably the fanciest hotel in Naples. Very upscale, modern hotel on a main street with beautify views of the harbor, bay, and Mt. Vesuvius. Our room was very large with a view of the bay and the cruise ships coming and going. The bathroom was especially fancy with an all-glass shower with a “rain” showerhead and a vanity in a separate area. The TV had several English channels. It is about a 10 minute walk to the Piazza de Plebicito, the Royal Palace, the Teatro San Carlo, and the Castle Nuevo. In fact, just about everything else in Naples is with walking distance as well. Breakfast buffet was included with our stay. Food was plentiful and tasty, with many different types of food (both European and American). The Italians don’t quite understand…",27
stylish luxury,50,Date of stay: July 2019,"My wife and I stayed 4 nights in July 19. All staff were friendly, professional and attentive. Room was comfortable and reasonably spacious. Cleaned to high standard. Great washroom facilities (plenty of space to actually put your wash stuff - too often overlooked). Breakfast was varied and all to high standard; v. good coffee, v. good poached eggs, and particularly liked the pastries (a local speciality). V. good restaurant service. Pool area on the roof was a bit space limited but not especially busy - hence served the purpose. But the main thing was the view from the restaurant and roof top pool area: Over the port area and city outskirts then Vesuvius in the distance to the left and scanning across the bay of Naples with Capri to the right. Spectacular (my photo's don't do…",50
"Lovely hotel, convenient location.",40,Date of stay: July 2019,We stayed for 2 nights at the Romeo Hotel and really enjoyed our stay. All the staff were very welcoming - and were happy to make suggestions to where we should visit in the short time we had in Naples. The rooms were beautiful and clean with evening turn-down service. Sadly we did not have time to experience the wellness centre. The pool area is quite small with the only sun loungers available (that I could see) are around the pool and are in shade on the afternoon. Buffet breakfast had a wide range of foods available and was very relaxed. We ate in the hotel restaurant on the first evening and had a very pleasant meal (sadly the michelin star restaurant was not open the evening we were there). The breakfast area has a clear view of Vesuvius (as seen on the hotel website) with…,73
Fornaggio with extra cheese,10,Date of stay: July 2019,"I love small boutique hotels, This hot lacks design, service and personality. Very poor service and reccomendations for dining. All in all really the worst. Very poor vibe with no relaxation. Chaotic mixr=ed materials throat the service. Absolute wort.",155
July 2019,50,Date of stay: July 2019,"Very welcome, clean, convenience location. Professional staff. Air-conditioned rooms and free WiFi throughout. Offers a continental or buffet breakfast. Definitely recommended to stay there. Vyacheslav",7
"Top Notch team, top notch hotel",50,Date of stay: July 2019,"Staff at front desk are impeccable, attentive, helpful, knowledgeable - all of them. The rooftop pool is welcome relief at the end of a long day. Rooms are spacious and well organized. Room service is prompt and reliable. Bravo.",2
"Excellent, great experience.",50,Date of stay: July 2019,"Loved it. Great location, we walked to the city center for dinner and back. The service was excellent and the breakfast top quality. Great location, close to all the meet points for my tours. Excellent staff, no problem finding an English speaker",1
Excellent Stay,40,Date of stay: July 2019,"Overall, the stay was great. Nice clean hotel. Service at breakfast and for evening drinks could be more attentive. For example, they seated 3 of us for breakfast at a table with only two settings, but did not set a third person. We had to get a setting ourselves from another table.",61
Hotel wonderful. Location not.,50,Date of stay: July 2019,I can’t say enough positive about the hotel and the service. The rooms and the common spaces are beautiful. However the location is far from ideal. Neighborhood is shabby and it was uncomfortable to walk around the area. The next time we would most likely stay in the Santa Lucia area.,1
Romeo Hotel Naples - Excellent Hotel & Service,50,Date of stay: July 2019,I have to say the Romeo Hotel is truly a 5 star hotel with 5 star service. It had all the WoW factors associated with Hyatt associated hotels. Staff really played their part to make our stay perfect. The hotel is in great condition with stunning views and facilities.,9
The Best Hotel in Naples,50,Date of stay: July 2019,"I have stayed and many hotels in Naples and by far my favorite is Romeo Hotel, across from the port, a beautiful, well kept modern building, adorned with exotic cactus, world class contemporary art and a Michelin star restaurant: Il Comandante. The rooms are exceedingly comfortable and many feature stunning views of Vesuvius and the Bay of Naples.",30
Great hotel in Naples,50,Date of stay: July 2019,A fabulous hotel with a great view of the bay. The location was great to tour Naples. Staff was helpful and nice. The Deluxe Harbor Suite was perfect with more than enough space for the four of us. Would definitely stay here again if I came to Naples.,2
Fantastic 26h at Naples,50,Date of stay: July 2019,Unfortunately we could only stay one night. But we enjoyed our 26h stay at Naples to the maximum thanks to hotel Romeo and the staff. The location is in walking distance of most of the city highlights and the view from our room or from the rooftop swimming pool on the Vesuvius is great. The staff gave us fantastic tips on where to eat (their own Michelin starred restaurant was closed as it was a Monday evening). Our lunch at the hotel was the best pasta we had during our stay in Italy and the breakfast buffet is great. When I go back to Naples I definitely will go to Hotel Romeo.,104
Romeo is the beast,50,Date of stay: July 2019,"This hotel is great. It’s a fantastic location, great bar and pool, great restaurant. Service is excellent. The spa was a relaxing respite after a long day of travel. We will stay here again absolutely.",1
Modern Gem Steps from the Hyrdofoils to Capri and Ischia,50,Date of stay: July 2019,THE place to stay in Napoli. Fabulous location and easy to visit Amalfi Coast locations and Naples. Beautiful hotel with a modern aesthetic. Loved it! Fabulous bar and rooftop pool. Also offers a Michelin star restaurant. Can't wait to return and stay here again.,8
Stylish Modern Hotel overlooking the port,40,Date of stay: July 2019,"Boutique style hotel with lovely bar / restaurant views out over the Bay of Naples. Friendly, helpful staff and an outstanding restaurant experience. Rooms are a little on the small side with insufficient space for baggage. Stylish shower wet rooms have insufficient towel hanging space and annoying movement sensitive lighting which leaves shower room in darkness after a few minutes (I was still in shower!) Overall, the style of the establishment, the food quality and the friendly, professional staff made for a very enjoyable stay. As befits the nature and quality of the service it is expensive.",18
Style over substance,20,Date of stay: July 2019,Not up to usual mr and mrs Smith standard. Mediocre Rooms less than adequate. Understandably rooms not as website suggests and comments about hotel accurate. Service at front desk excellent on arrival and during our stay. 9th floor restaurant maitre d rude and although a lot of staff very poor service. Waited 20 mins to even be offered a drinks menu and when I asked to order I was told all waiters very busy on the floor. Room mediocre. Room service poor. Turn down service is clearly limited to literally turning down bed covers! Bathroom left untouched and unserviced even from the day with toothpaste marks still remaining and towels adrift. This is by no means a 5 star hotel. Far from it. Very very disappointing.,117
Modern hotel in tough city,40,Date of stay: July 2019,"Best hotel in the city. Not a city I would want to visit again and there are very few decent hotels here, so if want at least 4 star plus then this is a good option. Staff are generally very helpful. Ok restaurant and small outdoor pool area, which was very popular during our stay - albeit absolutely no service at the pool unless you go looking for it. Beautiful day spa in the basement of the hotel. Interesting lobby area with table games. Unfortunately we didn’t notice until the last day - the hotel amenities were not pointed out to us on arrival. Staff were very helpful in providing information to get around the city.",10
"Insanely rude service, worst hotel experience of my life.",10,Date of stay: July 2019,"Booked my stay through Amex to get the FHR benefits but upon arrival, Phiippo and Slvia (the two people working the front desk) told me that my reservation was booked through Expedia, a total lie. I presented them with proof (written Amex confirmation) that the reservation was in fact booked through Amex and they didn't care, said that all that mattered was their online system (which of course only they can see and control). After a lot of insistence, they finally agreed to include breakfast in the rate making it seem like a huge gesture on their part, but said the upgrade wasn't possible due to no availability (when in fact the hotel showed plenty of availability online to the next room category), another lie. When I confronted them and showed them the availability, they got…",1
Not a five star hotel,40,Date of stay: July 2019,"This is not a five star hotel, it is a four star hotel. This is because the room especially the bed is quite small, not possible to accommodate an adult and the spa snd rooftop pool are quite small. Overall, facilities do not suffice to accommodate a hotel of this size. There were less than ten chairs aroubd the pool and the pool can accommodate at most ten people but thete are at least 100 rooms so at least 200 guests in the hotel. On the plus sude, the room and the spa look very modern, staff is friendly.",32
Modern Hotel Busy area,40,Date of stay: May 2019,Hotel was very model and well appointed.All the staff was very friendly and nice.The rooms were very nice well appointed and spacious.This was a very busy area of naples with a lot of road repairs going on which was not nice.Hotel service needs a lot of improvement.It took 5 calls and over an hour to get my complimentary water.Breakfast restaurant was nice with nice views and very good service.But there was hardly any vegetarian food.,80
Modern Italian touch!,50,Date of stay: June 2019,"We have choiced Naples for a weekend stop before reaching Sicily. Having already been in that area last year, in Sorrento and Capri, wanted to visit better the city itself. Romeo hotel is not nicely located, close to harbour but not far from downtown. Walking in the surrondings of the hotel is not a good choice, but the hotel itself is perfect and in less than 15 minutes you are in the city centre. Hotel is modern with high tech design elements. It offers multiple bars, rooftop restaurant and pool, and a gym and spa (very expensive but extremely nice). Good buffet breakfast, with lots of delicious and some extra plates you can order free of charge. Very comfortable king size bed, modern walk in shower, very elegant details and toiletries. Wood, glass and leather everywhere:…",2
Last stop on our way up the coast before flying home,40,Date of stay: June 2019,The Romeo hotel is a very nice four-star business type hotel although was perfectly fine for our last day on our trip up the coast. Although we stayed two nights to take in some of Naples in the end weregretted not just doing one night before our flight out. Not that the hotel itself had any issues. But Naples is a bit industrious crowded quite dirty and not much to see or do although we did find a cute restaurant within a five minute walk that had fantastic local seafood. Antonio’s The room your hotel had updated very Asian designer feel the staff was accommodating and friendly. The free breakfast buffet was a nice touch although mostly sugary carb type foods out when I asked for the smoke salmon that was on the all a cart menu they brought us a nice plate and had it…,36
"Hotel itself is 5 star, Staff is 3 stars",40,Date of stay: June 2019,"Hotel itself is amazing. Michelin restaurant on the top floor, 3000+sq ft gym with free weights, machine and cardio. Location is in the port so great for cruising to Capri or taking a car to Pompeii. Rooms are very modern and well built. Clearly the owner or owning group of this hotel knows a high quality product line. Where this hotel goes downhill is it's staff which is actually disappointing as owners work so hard to build something just to have the face of the company (staff) compromise the quality. Staff was often rude, pompous and unresponsive. We emailed several times, once about the spa and the availability in which case we did not receive a response and again about the $7000 credit card holds during our stay there which they disputed even after I showed them the…",2
Great spot in Naples,40,Date of stay: May 2019,"We booked a corner suite which had a great view of the harbour and Bay of Naples with all the ships coming and going. The room was large, well appointed and very comfortable. The hotel is very modern with clean lines. Breakfast in the morning was in a lovely room with another great view of the harbour. Walking distance to the ferry terminal and the castle. Staff was very helpful and friendly. The bartender in the lobby bar was great, Nicola, was lovely very interesting to speak to - and made a great Negroni! The wine cellar is gorgeous!",132
Amazing stay in Napoli,50,Date of stay: June 2019,"From the second I arrived, I could tell the quality of the hotel. A friendly greeting and smooth check in. The kind lady on reception showed us to our room and how everything worked. The room itself was amazing and had all the small touches an excellent hotel should have; water and charging port right near the bed, the most comfortable pillows, robes & slippers, which I might add is not a luxury found in many Italian hotels, and all the other amenities you could imagine. This place is a haven in a busy city and definitely whilst travelling through Italy. It’s right beside the port and had a metro link a few minutes away. The pool was small but cute and had a view of mount Vesuvius. Wouldn’t think twice about staying here again, loved every second and didn’t want to leave!",23
Great place to stay in Naples,50,Date of stay: June 2019,Everything about this hotel is super impressive. They obviously put a lot of work into their decor because it's all very modern and cool. The restaurant has a great view and the pool was really nice. I wish the pool was bigger but given the space constraints it made sense. The staff was friendly and helpful. When we needed a cab it was there in less than two minutes! Naples is a wonderful city and the hotel is very centrally located. I would definitely stay here again.,1
Helpful staff who went out of their way,50,Date of stay: May 2019,"My husband and I stayed here on our honeymoon, which was our first three nights being in Naples. We loved our Wellness Suite. It was absolutely beautiful, with a nice sitting area and fireplace. The furniture was clean and modern and there was ample closet space for our belongings. We also had a beautiful jet tub, along with the listed amenities (sauna, steam room and a private toilet room). The drinks, food and views were also to be commended. The decor had such amazing personality, as well. Please stay at the hotel that doesn’t let you down. The most important aspect of our stay, however, was the service. You see, the second day we arrived (Saturday) I broke my foot. This is not happen on the property. I ended up awakening in excruciating pain in the night and my husband and…",31
Lovely Naples hotel.,50,Date of stay: June 2019,Very good all round experience. Concierge desk was excellent. The spa was very good. Restaurant facilities excellent.Disappointed that there was no mention of the extremely ugly warehouse blocking our view of the harbour!,4
This hotel was excellent!!!!,50,Date of stay: June 2019,I was beyond happy with this hotel!!! So beautiful!!! It was extremely relaxing and gorgeous!!! So close to the port! Literally walked across the street and got on the ferry to the beautiful Capri!!!! Truly a beautiful hotel and staff!!!!,2
"Nice staff, nice restaurant, bad everything else",20,Date of stay: June 2019,"Very nice staff, and quite a good Michelin starred restaurant with a wonderful wait staff. But that's about it. The decor of the hotel is kinda cool, if it was still 1989. However, the rooms are HORRIBLY designed...from the non-functioning AC (and forget trying to read the ridiculous directions); the weird motion sensor lights in the bathroom that go off while you're showering; the inexplicably complicated light switches; the shallow sink that causes water to splash out everywhere; to the fact that the shower door opens flush to the floor, which means you can't put a bath mat down because the door just sweeps it away. AND YET, even then this place would be passable, but for the FILTHY shower stalls that had MOLD and SOAP SCUM. Housekeeping is clearly not well-managed! IMO,…",5
Was treated with disrespect,10,Date of stay: May 2019,"I was travelling as a single woman and I felt like I was treated with disrespect at this hotel. They kept calling me Mrs. and I had to correct them. They thought being single was an insult... As a physician, my vacation time is more valuable to be spending at such places... Wishing them significant improvement!",327
Naples for a 50th Birthday,50,Date of stay: May 2019,"A short trip for my wife's 50th, heading out to Pompeii and the Amalfi Coast using Naples as a base, we decided upon the Hotel Romeo as being near to everything within Naples that we wanted to see and our experience of the Hotel, its staff and the amazing Il Comandante restaurant were nothing short of exceptional, the restaurant was worth the visit alone. The room we had was a deluxe double with a decent sea view, not that we were in the hotel too much as there was too much to do elsewhere, the room was very clean and tidy with everything we needed. We had great service from all the staff we met who were friendly, kind and courteous which made our short stay even better and we had a memorable stay for my wife to look back on for this special birthday.",1
Definitely the best hotel in Naples,50,Date of stay: May 2019,My family stayed here for an evening after the Amalfi Coast. It was a beautiful hotel with great decor and a kind staff. It was conveniently located to Old Town and had a lot of walkable attractions. We had a two bedroom suite and it was stunning. I would definitely stay here again. Only comment is that they made the photos of the pool look much larger than it is. It is a really small space so don’t expect to make a day out of that.,226
"Beautiful, classy and unique hotel",50,Date of stay: May 2019,"Wow, what a refreshingly unique hotel. I was with group and we were warmly welcomed into the beautiful lobby with some refreshments and pastries. Then I got to the room and found a lovely hand written note with some decadent chocolate. Each day they even had a different treat waiting for me. They even had turn down service and they placed slippers by the bed. The room was very modern, but classy too. The bed was very comfortable and I slept well. The one very small complaint was I struggled a bit with the lights and other switches. For instance the drapes were on a motorized system and the controls were by the bed. But if that's my only complaint, then they're doing well. The breakfast was very nice and filling with a beautiful presentation. The location was good as you…",36
Odd location but the spa is worth the stay,40,Date of stay: May 2019,"I booked this hotel based on the fact it has been nominated as a Mr & Mrs Smith Hotel, a brand I trust and rarely lets me down. I can see why this has been nominated as such - in a chaotic city like Naples, there aren’t many boutique options and I’m sure this is probably one of the best of the bunch. However at more than £350 a night it is certainly punchy considering other options which are more central. If you want to stay one night in Naples and consider being close to the port (Molo Beverello) an advantage, then it’s a good option. The spa is really excellent. However the rooms are modern but not sleek, quite dark and the port area isn’t great after dark. For the money, you could stay over in the fancier Chiaia district and be in the heart of it all. Having said that the…",150
Brilliant luxury in chaotic Naples,50,Date of stay: May 2019,"A stunning hotel, sleek and modern. Very comfortable beds and great service. We liked the location based on proximity to metro, one stop from train station, and about a 20 minute taxi to airport. It was in a good area for walking to popular bars, restaurants, and a promenade area that we visited both nights of our stay. You can see Mount Vesuvius from harbour view rooms, bar and pool.",95
Modern Hotel in Ancient Naples,40,Date of stay: May 2019,"I chose the Romeo for its nearness to the ferries going to Sorrento as I had planned a day excursion. But I chose it also for its commanding views of Mt. Vesuvius and Capri, both of which I could see from my waterfront room. The weather was overcast dimming the views, but the design and comfort of the room made up for this disappointment. The staff in all areas we used were extraordinarily gracious and helpful. Breakfast was a delight.",77
