review_title,review_rating,review_date,review_body,user_contributions
Snazzy luxury and great staff -- still working out the offerings,40,Date of stay: June 2023,"Impressive modernity with many bells and whistles. Staff attentive and competent. Breakfast buffet amazing. Two offerings comments: the pool was a small plunge pool (more like a large bathtub), and they were cagey about open restaurants (the one still in reviews was closed for renovations). Worth a change from the typical high-end hotels in older buildings.",209
Avoid this hotel,20,Date of stay: October 2023,No way this is a 5 star hotel. Ugly design. Tiny rooms. Pictures are highly deceptive. Pool is tiny. Spa is low quality. Silly expensive for what you get. Then they used a ridiculous exchange rate when converting from EUR to USD when billing me.,2
Great hotel!,50,Date of stay: September 2023,The hotel was in a convenient location to what we planned on doing throughout our trip. Hotel staff was very friendly and the hotel itself was clean. Our room was spacious and comfortable. The fitness center is everything you could ask for in a hotel and gym and then some! We would definitely stay here again if our travels bring us back to Naples.,10
Artistic Elegance,50,Date of stay: October 2023,"Nothing but the best ambiance, decor, comfort, and amenities coupled with hip art throughout the facility. The concierge was friendly and helpful and the breakfast top notch with delicious fresh pastries. We spoiled ourselves and enjoyed every minute!",1
Nice Place,50,Date of stay: October 2023,Overall beautiful property with very helpful staff. Location is perfect to explore Naples. Price is very high but for Naples we are glad we splurged and saw as much as we did. The ferry launch to Capri was literally right in front of the property,1
Did not live up to expectations,20,Date of stay: September 2023,"I was eager and excited about staying at this hotel. The photos online looked amazing. The front desk staff was exceptional, however the rest of the wait staff continuously underperformed and 8 out of 10 times got our bar orders wrong. The pool area was pitiful. The lobby and hotel itself looked nice but it was sadly a case of looks are deceiving.",1
Not one bit of storage space.,30,Date of stay: September 2023,"The hotel is lovely and the people on the staff were helpful and very pleasant. But the room size and room accommodations were terrible. There was two small drawers for our clothes in the closet so you must live out of your suitcase. Then, there was no room to store the suitcases, and so they were in our way in the small hallway every time we had to leave the room. Folded clothes and paraphernalia had to be left all over the table and desk, so the room always looked messy. We had a view looking over Mt. Vesuvius which was very lovely. At least this gave us the feeling of more space.",1
Lovely hotel in so-so location,50,Date of stay: September 2023,"Spa wonderful. Best massage I ever had. Two hours each day in pools and heat rooms included. We used them every day. Michelin star restaurant was gracious, lovely and reasonable. Location near harbor a bit iffy but I’m not sure where in Naples would be better",6
Comfort and Convenience with Artsy Flair in Naples,50,Date of stay: June 2023,"Deserves high praise for convenience, cleanliness and interesting decor with warm hospitality and smiling service. Taking a return flight to NY through Naples after visiting the Puglia region, an easy drive to, we decided to spend a couple of days in this vibrant city.",73
Great hotel in Naples,40,Date of stay: July 2023,"The staff was friendly. The rooms are clean and modern. The spa with the salt room was one of our favorite things here. Easy walking to everything. The hotel is a stark contrast to Naples...clean, modern, a great place to end your day.",1
"Pricey, but nice",50,Date of stay: September 2023,"We stayed at Romeo Napoli towards the end of our honeymoon. The deluxe front room was quite nice, with nice amenities and the most comfortable bed we stayed in during our 2 week visit to Italy. The room itself had a lot of ""smart"" features, which took a moment to figure out, but was great. The location is adjacent to the port and walking distance to the cruise terminal. We were in Ischia prior to arriving in Napoli, and the close proximity was excellent. Please note that this is a pretty industrial port. You're not going to have a Positano-esque view from your room. That said, the view in the breakfast area was pretty cool. We watched a thunderstorm roll in up there. Seeing some lightning strike around Vesuvio felt like something out of Roman mythology. The staff was very…",7
Very happy I made this choice,50,Date of stay: September 2023,If you are going to stay here book a junior corner suite. The hotel is beautifully appointed. Slightly quirky in some of its decor in common areas. The people at reception are happy and smiling all the time. Breakfast is excellent. The pool is small but fine if you want to take a dip. We wouldn’t hesitate to stay there again. The surrounding area is a bit rough but there are great restaurants on the doorstep.,15
Pretentious and poor service,10,Date of stay: September 2023,"I normally would not submit a bad review, but most of the employees at this hotel were incredibly pretentious and rude and the drink and door service was very poor, which is a shame since the breakfast food was great. The 90EUR credit they offered seemed great, but then at 30EUR for a 4oz glass of wine it feels like a scam. We were so put off, we decided not to eat in their 1 Michelin Star restaurant, which they were quick to tell us about again and again. Someone should be reconsidering their Michelin Star.",64
Worth the $,50,Date of stay: September 2023,"The room was nice, the hotel staff was great- especially Andrea- he was very helpful and made some great recommendations for us. Being able to use the spa facilities was a huge plus, especially after flying in and with any down time we had. Breakfast was really good . Would stay here again.",13
Cozy like a railroad flat,30,Date of stay: September 2023,"The staff is super, no complaint there. The food was wonderful, both breakfast an a snack at the bar, so no complaint there. The location is a bit funky but extremely convenient to everything we choose to do. So again no complaint there. So why the three stars instead of four or five? The architect/designer clearly never spent a night at his creation. The rooms are cruise ship small. The closet space could not accommodate our reasonable amount of clothing. We kept our belongings in our luggage for the most part. There were only two small drawers for clothing. Oh and nowhere to store your luggage. They lined our narrow entry alleyway. The number of times I stubbed my toe or wacked my shin in the six days of our stay were in the high two figures. But you can’t open the teeny…",78
Birthday trip,50,Date of stay: August 2023,"Fabulous hotel. It’s not perhaps the prettiest location overlooking a busy port, but we loved it. Harbour view room - 507- watching cruise ships, ferries, hydrofoils etc. Room is compact but super comfy. Breakfast on 9th floor is fab - excellent staff. Lovely pool - it’s not big but it’s a city hotel. It’s a super chic hotel with excellent staff. The one negative comment would be - be careful when you order drinks! We did get a surprise which put us off a bit. Also amazing spa/gym. Also birthday celebration and were presented with the most amazing tasting cake at breakfast & the birthday boy said best ever cake he’s eaten. Wow - it was amazing",95
Wonderful hotel!,50,Date of stay: August 2023,"Absolutely amazing hotel! The area is eh, but the staff, the facilities, the breakfast, everything was so great. If you have to spend a night in Napoli, I would absolutely recommend this hotel. Chiara, I believe the manager, was extremely accommodating and helpful!",8
"Terrific hotel, facilities, people",50,Date of stay: July 2023,"Had a wonderful stay with the family. Rezervations and front office staff arranged all our plans for site visits and trips in the area. Fabulous design and art. Very central High quality in everything; people, rooms, food, experience From reservations, reception, concierge, bellboys, waiters, to housekeeping, everyone very competent and professional Our children who are basically adults now were very happy as well. Adult and quiet place - Might not be ideal for young children Would visit other properties if they open them Would come back again",1
"Great location, great gym, excellent pastry!",40,Date of stay: July 2023,"The breakfast buffet has great pastries - sfogliatella, Roman cream bun, mini strawberry tarts and the list goes on. For us, this was the highlight. With a Michelin star restaurant we expected the pastry to be good and we weren’t disappointed! The coffee is well made and tastes good. With all that eating, we were so pleased to see this hotel had a large, very well equipped gym. The gym contains techno gym equipment and proper weights! It’s one of the best gyms we have visited at a five star hotel in Italy. The reception and downstairs staff are friendly. We thought the location was great. It’s easy to walk around the centre of Naples and the hotel faces the harbor where the big cruise ships dock. One small thing - one morning we had breakfast around 9.30am and it was very…",299
Hotel Romeo saved the trip!,50,Date of stay: July 2023,"Hotel Romeo was a bit out of our price range so we didn’t originally book here. My sister and I were traveling through Europe for 3 weeks and Naples was the last stop. After checking in at another hotel where it did not live up to its photos in many ways and also didn’t uphold the marina view room price we booked, we called Hotel Romeo. They had limited rooms left but were able to work with us on finding a room for three nights. It was absolutely perfect. Amazing location, tremendous hospitality from beginning to end. Close to the ferry as we spent a day in Capri. Spa was really wonderful..one of my best massages ever. The breakfast was divine and pool area spotless. Would stay again in a heart beat. Special shout out to Stefania at the front desk who was our “go to” got…",3
A marvelously run hotel,50,Date of stay: July 2023,"It was a real pleasure to stay at this hotel. The staff is outstanding and always shows great warmth and professionalism. They go out of their way to be helpful in every way possible. The location is excellent. While facing the port with the huge cruise ships would not be my choice, the location is so central to all the major sites in the city. The breakfasts were excellent. I did not dine in their fine -dining restaurant. There is a small pool with a great view of the harbor. Thank you to the entire staff for making my stay so very enjoyable.",427
Stay elsewhere,10,Date of stay: June 2023,"The only reason I picked this hotel is because I’m a globalist with Hyatt. This however is not a typical Hyatt. They do not provide any of the same perks. We called a few days before our arrival and asked about early check in and they told us we needed to book another night. I truly disliked this hotel and the manager. We had an issue with one of the rooms and the manager was completely unaccommodating and arrogant. This was supposedly a five star hotel, and it had none of the characteristics. The rooms were clean, I’ll give it that. The view was of an old ugly building, and was supposed to be a harbor view. If you stood on the far right side of the window you could see the harbor. The bed was two twins stuck together, and the pool was about the size of a postage stamp.…",4
Not worth the money,20,Date of stay: June 2023,"Stayed twice, 1 night each at the beginning and end of a boating vacation out of the Naples harbor. High design hotel but pay attention or you won’t be able to work the shower. The windows in the 9th floor restaurant are beautiful but radiated so much heat I had to move. The restaurant is stupidly expensive and honestly the local trattoria was better. Then there’s the staff. The front desk is mediocre and the valets can’t even call a cab having to rely on the front desk staff. We had the front desk book a car tot the train stain for 4 people and 5 bags. The car that came was too small so, running out of time to catch our train, we asked for 2 normal sized cabs. The front desk manager was so irritated she came out and started berating us an insisted this was all our fault.…",4
Excellent,50,Date of stay: June 2023,"Excellent service, food and ambiance will def come back again! The restaurant tasting menu was superb and the pool im the roof is a nice addition to relax after walking around Naples. Reception team were attentive and professional.",4
An amazing stay!,50,Date of stay: June 2023,"The ROMEO completely exceeding our expectations. Such a beautiful hotel with amazing service. By far the best hotel we have ever been to! From the initial check in - Nicole helped us and was so sweet, helpful, and gave great recommendations. She definitely took our experience from a 9/10 to a solid 1000/10. Next time we are in Naples we are 100% staying at the ROMEO hotel.",1
The best choice in Naples,50,Date of stay: May 2023,The Romeo in Naples is one of the best hospitality experiences i have had in Europe till date... the staff was very warm and very well-appointed rooms.. Very courteous staff who were more than willing to make your trip as comfortable as possible.. had dinner in their specialty restaurant and it was just an excellent experience. though location is not absolute city center but still it was a good option for us.,13
Nice but pricey and I would consider elsewhere next time.,30,Date of stay: June 2023,"Easy to get to. Lovely staff. Comfortable bed. Good breakfast buffet. View from corner junior suite not the greatest - tatty warehouse directly opposite. Expensive valet parking. Expensive room service options. Decor eclectic. The room seemed not to make best use of space - just seemed smaller than stated size. Frustrating electrically operated curtains. The lobby area is nice with a nice bar and more eclectic decor. Nice cacti display around outside of the hotel. I did not eat in the restaurant, but it does have an expensive Michelin star restaurant. Overall, the price of the hotel is too much for what it has although we did enjoy our stay.",431
Loved this hotel,50,Date of stay: May 2023,"We started our three week trip in Italy and Malta at the Romeo hotel in Naples. The staff is friendly and super accomodating. I wanted a last minute street art tour and they found someone who was really good in an hour. The spa is really great with infra red saunas, a salt room and great steam and sauna area. You can easily spend the day there.They make a great martini at their fabulous bar. The design of the hotel is so interesting and everywhere you look you see something that you didn't see before. The rooms are great and I left my iPad and it was waiting for me when Ir returned to Naples three weeks later..i really wanted to stay there on my way back but they were full. I highly recommend this hotel when you re in Naples.",13
Rainy time in Naples,50,Date of stay: May 2023,Despite the rainy weather Hotel Romeo was a highlight and made out time in Naples exceptional. From the caring and helpful staff to simply the best hotel umbrellas I've experienced! The hotel spa is brilliant and easily worth spending an hour using the facility. Great views from our room to the harbour and great restaurant recommendations.,31
"Great sleep, nice room, service quality varied and expensive!",30,Date of stay: May 2023,"Service varied by way of quality. At breakfast we were not told there were hot options available on request. We only found out when we saw another guest getting fried/poached eggs etc. by then it was too late. On contrast the staff on reception were exceptional. Spa is great. Rooms clean, bright and so comfy. If service was consistently high I would have scored more. This is a 5 star hotel and IMO plenty of room for improvement in that department.",4
A wonderful stay in a marvelous city …!!,50,Date of stay: May 2023,"We were genuinely surprised how friendly the people of Naples are and how fascinating the city is. Our home (and really it felt like home) was ROMEO Napoli, and the hotel staff were our new family. The hotel is stylish, but comfortable … incredibly stylish, but also comfortable and welcoming.",1
Stay Review,50,Date of stay: May 2023,"Hotel was very well appointed. Stay was very kind and attentive. Upon our departure at 6:30am staff put together a to go breakfast for us to take to the airport, this was the cherry on top for us. Very we'll done!",3
Stylish and Comfortable,50,Date of stay: April 2023,"The staff at Romeo are top notch and helped us to relax and enjoy our stay while in Naples. The decor at Romeo is stylish, but not over the top. Our suite was a good size, clean and very comfortable. The coffee was excellent and the breakfast items high quality. My wife tells me the salt room at the spa was very nice. We have traveled a lot all over the world and we can definitely say Romeo is a fantastic hotel.",1
April trip,50,Date of stay: April 2023,"Beautiful hotel, lovely design, fixtures and fittings and top quality service. Outstanding breakfast and spa experience was great! Food in downstairs bar was also very good. Overall a great experience.",2
A fantastic hotel in Naples,50,Date of stay: March 2023,"Really a fantastic hotel. What really made it was the staff. Not only was everyone incredibly helpful and willing to do anything to make our stay better, they always remembered who we were and what we'd needed before. Nothing every got dropped (rare even at a 5-star hotel).",20
Exceptional oasis in the Bay of Naples,50,Date of stay: March 2023,"Everything about our stay was exceptional. The room was immaculate, comfortable and welcoming. The hotel architecture was a beautiful departure from the conventional luxury hotel, but lacked none of the expected luxuries. The breakfast was truly exceptional, even by the high culinary standards of Naples and Campania. And the staff was amongst the warmest, welcoming and helpful that we have encountered anywhere. Truly outstanding!",4
True Luxurious Accommodation,50,Date of stay: December 2022,"We stayed at Romeo Hotel for 9 nights in December while we were in the Naples area to celebrate my birthday. The location was perfect, restaurant and bar were second to none, and the staff were amazingly accommodating and friendly to name a few - Carmen, Francesco, and Georgio made a lasting impression on us. Georgio also made some of the best cocktails we had and was able to recommend cool evening activities for us. Every day the Romeo staff went out of their way to say hello and to see if there was anything they could do to help us enjoy our time in Naples. They arranged several fun activities for us such as a day trip on a private tour to Amalfi Coast, activities in the area, shopping, and were able to get us into some of the best local restaurants that we previously could…",1
Great New Year experience,50,Date of stay: December 2022,Service and amenities are excellent. The interior design is somewhat dated and too eclectic - but that's personal taste. We understand that the hotel will be refurbished in January. Special thanks to the people at the reception and the hosts at breakfast - top notch service and friendliness.,4
Exceeded the standard,50,Date of stay: December 2022,"The manager makes this hotel, his leadership is some of the best I’ve ever seen, the staff are a reflection of him, and they all exceeded the standard. Our experience was so good we came back again on our month long trip to Italy.",1
"Nice hotel, not worth the price",30,Date of stay: June 2022,"This hotel itself was nice, but I was disappointed with some of the amenities. One of the main reasons we chose this hotel was for the outdoor pool and deck, but when we arrived, we were shocked to find out that these amenities were closed without any notification or discount offered. This was especially disappointing since we visited during the COVID-19 pandemic and were looking for a place to relax outdoors while still being able to take mask breaks. For the price we paid (over $600 per night), I expected better communication and at least the option to use all of the amenities that were advertised. One of the best parts of the hotel was the breakfast buffet. The selection was vast, with options ranging from bread, cheese, fruit, and yogurt to pizza and eggs cooked to order.…",151
"Nice hotel, good quality",50,Date of stay: December 2022,"A good surprise. Hotel has a Very good location, good service and quality. I Will be back for sure. Perfect option to stay with Friends, family or for a romantic weekend. Breakfast was so delicious, staff so professional and friendly. Cleanneless IS top. Good job! We Will recommend to my friends",25
Central location,50,Date of stay: September 2022,"The hotel works for most people looking to quickly pass through. Not in a luxury area, but good for Naples. Very busy area around hotel, and you have to cab to most restaurants. (The Hotel restaurant was being remodeled during our stay.)",62
A great hotel,50,Date of stay: October 2022,The hotel is beautiful. From the moment you walk in and see the lovely artistic waterfall to the ninth floor where meals are served in a gorgeous room. Our Most positive comment is to the niceness of the staff. Everyone we interacted with was wonderful..,5
Terrible!,10,Date of stay: August 2022,What you see on their website and what you get when you are there are two entirely different things. You can do better staying elsewhere in Naples for sure and for a lot less money than this place. Where to begin!…the lobby bar and restaurant you see on their website is closed only open for special events….wish I knew that when we booked our trip because we thought that lobby bar would have been a cool place to have a drink with another friend who was also visiting Italy when we were. Their Michelin Star restaurant was also closed and won’t open until November if you believe their website?…that left us with one restaurant on the top floor serves luke warm coffee every morning despite sending it back only to be brought more luke warm coffee in return (see other reviews…,1
First Class Experience.,50,Date of stay: September 2022,"A really amazing time we had with the fantastic staff and the beautiful surroundings of the Romeo hotel. Everything was completely perfect, the service is top class and the friendliness of all the staff is really genuine !! Grazie mille!!",1
"Pumped up, overpriced. Horrible location.",30,Date of stay: September 2022,"Sorry but not really ""my cup of tea"". Designer, boutique, up-market, posh, expensive, stuffy, a bit full of itself etc.... Not relly what I look for in a hotel. Beautiful entrance lobby. Roof terrace needs to be booked!",1012
WE LOVED IT,50,Date of stay: September 2022,"The Romeo is an hotel on the dock side of a very busy, bustling city. Our first experience was the beautiful entrance lobby, with art and exotic items aplenty. We were greeted by a very helpful young lady, who made us feel so welcomed. We have visited the Italian peninsula many time, but never Naples before. What a city. Everybody that we encountered in the hotel tried their utmost to make our stay the best experience. We never had a problem with communicating ( in English ) with every member of staff. The breakfast was superb…by the way, the best scrambled eggs we have ever tasted. Lunch and dinner service was professional, with a great selection of local foods. We slept like logs on the comfy beds, and were surprised how successful the sound proofing was. We were on the main…",3
Poor,10,Date of stay: August 2022,"Really surprised how poor this place is. The other reviews are perplexing. 35 degrees outside, the lobby isn’t much cooler. There is warm water on the side to drink with no ice. A euro 550 per night has a view of scaffolding (see pic). The room itself is a box bathroom within a box bedroom ie half the bedroom is cut in to with the bathroom! You have to walk through the toilet area to get to the shower (?!) and perspex panels offer no privacy whatsoever. Bizarre blue light is the do not disturb button which lights up the whole room all night to the extent we had to switch it off. Other light debacles include the auto light when walking in the bathroom during the night and thereby waking the other up. Many of the electric sockets didn’t work nor the illuminated vanity mirror…",146
Wonderful Hotel in Naples,50,Date of stay: August 2022,"We spent a great night here! We loved the room design (except for the odd lighting system), the comfortable bed, and the helpful front-desk staff. The breakfast was also quite good and the location of the hotel worked well for sightseeing. Naples gets a bad rap, which I don't think it deserves. I look forward to going back to Naples and the Romeo in the future!",4
Unforgettable experience,50,Date of stay: August 2022,"From Alessandro and the woman who was working with him at the front desk to Francesco who not only helped with bags but kindly helped orient us, it was an amazing experience. Thanks for the sfogliatella dessert suggestion! They didn’t treat us like tourists but like a guest in their house house with all sorts of suggestions to have the optimal experience in a place they take pride in and they were on point each time. The hotel was also very luxurious - and clean. We also had an amazing view of all the big sites. Everything seems so thought out, making it very chill. Oh and try the complimentary brekkie! Def coming again.",1
